surface,reading,romaji,pos,frequency,short_translation,detailed_translation,used_in_sentence
多重,タジュー,tajuu,名詞-普通名詞-一般,1,multiple,"Refers to something that involves or consists of multiple layers, levels, or instances. Often used in contexts like multiple layers or multiplicity.",この問題には多重の要因が関与しています。
放せ,ハナセ,hanase,動詞-一般,1,release,"The verb '放せ' means to let go or release something, typically used when telling someone to release or let go of an object or a person.",そのロープを放せ！
持つ,モツ,motsu,動詞-一般,1,hold,"The verb '持つ' (motsu) means to hold, carry, have, or possess something. It can also imply the maintenance or retention of an object, idea, responsibility, or relationship.",彼女はバッグをしっかり持っている。
場所,バショ,basho,名詞-普通名詞-一般,1,Place,"The word '場所' refers to a 'place' or 'location' in a general sense. It can be used to denote any physical space or area where something is or occurs. It can refer to locations in both urban and rural contexts, and is used in various situations to specify a point or environment.",会議の場所を変更しました。
憎い,ニクイ,nikui,形容詞-一般,1,hateful,"Describes someone or something that is detestable, loathsome, or abominable in nature. It conveys a strong feeling of dislike or disgust.",彼の裏切りは本当に憎い。
孫,マゴ,mago,名詞-普通名詞-一般,1,grandchild,"The word '孫' translates to 'grandchild' in English. It refers to the child of one's son or daughter, essentially the offspring of one's children.",彼は孫に会うのを楽しみにしている。
守っ,マモッ,mamotsu,動詞-一般,1,protect,"To protect, defend, or guard something or someone, ensuring safety or security.",彼は約束を守った。
引き付け,ヒキツケ,hikitsuke,動詞-一般,1,attract,"To attract or draw something towards oneself, often used in the context of something appealing or interesting.",彼は彼女の注意を引き付けた。
思わ,オモワ,omowa,動詞-一般,1,think,"This verb means 'to think' in the sense of having thoughts or opinions about something. It can also imply considering, feeling, or perceiving within the mind.",彼はいつもポジティブに思わ。
引く,ヒク,hiku,動詞-一般,1,pull,"The verb '引く' primarily means 'to pull' or 'to draw', as in pulling an object towards you or drawing a line. It can also mean to subtract in mathematical contexts, or to play a string instrument by drawing a bow across the strings.",子供はおもちゃの車を引く。
思っ,オモッ,omotsu,動詞-一般,1,thought,"The past tense form of the verb 'think', meaning to have considered or formed ideas and opinions in one's mind.",昨日のことを思っています。
引け,ヒケ,hike,動詞-一般,1,pull back,"The verb '引け' typically implies pulling back or retreating, often used in contexts where a physical or metaphorical retraction is taking place.",彼は怖くなって一歩引けた。
強,ツヨ,kyou,形容詞-一般,1,strong,"Describes something or someone with strength, power, or intensity. It may also refer to emotional resilience or robust characteristics.",彼は非常に強い人です。
忍者,ニンジャ,ninja,名詞-普通名詞-一般,1,ninja,"A ninja is a covert agent or mercenary in feudal Japan who specialized in unorthodox warfare, espionage, assassination, and guerrilla tactics. They are often depicted as wearing dark clothing and possessing stealth skills.",子供たちは忍者になりたいと思っている。
忍,シノブ,nin,名詞-固有名詞-人名-姓,1,Shinobu,Shinobu is a Japanese surname. It is often used as a family name and can be found in historical and contemporary contexts.,忍さんは有名な作家です。
強く,ツヨク,tsuyoku,形容詞-一般,1,strong,"Describes something that is powerful, intense, or firm. It can refer to physical strength, influence, or force of emotion.",彼は強く頑張ったが、怪我には勝てなかった。
当ったり前,アッタリマエ,atsu,形状詞-一般,1,natural,The word '当ったり前' can be translated to 'natural' or 'obvious' in English. It is often used to describe something that is taken for granted or is seen as self-evident or normal.,彼が成功したのは当ったり前のことだ。
心配,シンパイ,shinpai,名詞-普通名詞-サ変形状詞可能,1,worry,An emotional state of concern or anxiety about potential negative outcomes or problems.,彼の健康が心配です。
形,カタチ,katachi,名詞-普通名詞-一般,1,shape,"In English, '形' (katachi) generally means 'shape' or 'form'. It can refer to the physical shape of an object, the form of something abstract, or the way something appears.",この箱の形は四角です。
心変わり,ココロガワリ,kokoro,名詞-普通名詞-サ変可能,1,change of heart,"A change in one's feelings, opinions, or attitude towards something or someone.",彼は急に心変わりして、計画を変更した。
方,カタ,hou,接尾辞-名詞的-一般,1,person,"The word '方' is a noun used as a suffix to refer to either a person or direction, often indicating the side or person associated with an action or attribute. It can also imply someone who acts or performs.",私の方が正しいです。
心,ココロ,kokoro,名詞-普通名詞-サ変可能,1,heart,"The organ in the body that pumps blood, or metaphorically, the center of emotion or thought; often used to refer to one's feelings, intent, or spirit.",彼の言葉には心がこもっている。
彼,カレ,kare,代名詞,1,he,The word '彼' is a personal pronoun in Japanese used to refer to a male person. It corresponds to 'he' in English and is used to denote a male third person singular subject.,彼は学校に行きました。
待て,マテ,mate,動詞-一般,1,wait,The command form of the verb 'to wait'. It is an imperative form used to order or request someone to wait.,犬に『待て』と合図を出した。
復習,フクシュー,fukushuu,名詞-普通名詞-サ変可能,1,review,The act of going over or studying material again; it involves revisiting the learned material to reinforce knowledge or understanding.,テストの前に復習をすることが重要です。
復しゅう,フクシュー,fuku,名詞-普通名詞-サ変可能,1,Revenge,The act of seeking retribution or payback for a wrong or harm done. It can involve retaliatory actions taken against someone in return for an offense.,彼は友人のために復しゅうを誓った。
度,ド,do,名詞-普通名詞-助数詞可能,1,frequency,"'度' is a noun that can mean frequency, occurrence, or instance, often used to count the occurrences of an event. It can also mean 'degree' as a unit of measurement for angles or temperature.",この問題は三度も発生した。
年,ネン,nen,名詞-普通名詞-助数詞可能,1,year,Refers to a period of 12 months or 365 days. It can also be used as a counter for years in Japanese.,私はこの町に十年以上住んでいます。
性,セー,sei,接尾辞-名詞的-一般,1,nature,"This suffix indicates a trait or characteristic quality, often used to form nouns describing nature, characteristics, or types.",彼の性格は温厚です。
安定,アンテー,antei,名詞-普通名詞-サ変形状詞可能,1,stability,"Stability refers to a state of being stable, where something is steady and not prone to change or fluctuate significantly. It can include financial stability, emotional stability or physical stability.",この地域の経済は安定しています。
戦っ,タタカッ,tatakatsu,動詞-一般,1,fight,"The word is a verb that means 'fight' in the sense of engaging in a battle or conflict, either physically or metaphorically.",彼は勇敢に戦った。
我慢,ガマン,gaman,名詞-普通名詞-サ変可能,1,endurance,"The word '我慢' refers to the ability to endure, practice patience, or tolerate discomfort or hardship without complaint. It can also mean perseverance or self-control.",彼は我慢して長時間働き続けた。
懸け,カケ,kake,動詞-非自立可能,1,bet,"To bet or wager something, often involving risk or the potential for loss or gain, as in placing a bet in a game or taking a risk in various situations.",彼は試合にすべてを懸けた。
実体,ジッタイ,jittai,名詞-普通名詞-一般,1,entity,Entity; a thing with distinct and independent existence. It can also refer to the substance or essence of something.,そのプログラムはデータベース内の全ての実体を管理します。
憎ん,ニクン,nikun,動詞-一般,1,hate,"The word '憎ん' is the pre-masu stem form of '憎む', which means to hate or to detest someone or something. It conveys strong dislike or aversion.",彼はその犯罪者を心から憎んでいる。
家,イエ,ie,名詞-普通名詞-一般,1,house,"A building where people live, typically consisting of a ground floor and one or more upper floors, providing shelter and a place of residence.",私の家は大きいです。
家,カ,ie,接尾辞-名詞的-一般,1,house,"When used as a suffix, '-家' can denote a person associated with a particular skill or field, similar to '-ist' or '-er' in English. It can also simply mean 'house' or 'home' in other contexts.",彼は音楽家です。
後,ゴ,nochi,接尾辞-名詞的-副詞可能,1,after,"This is a suffix that can follow nouns in Japanese to indicate the sense of 'after' or 'later,' suggesting a sequence in time. It is used to express a timeframe or sequence, such as after a certain event or period.",試験の後、映画を見に行きます。
屋,ヤ,ya,接尾辞-名詞的-一般,1,store,"The suffix 屋 attaches to a variety of nouns to mean 'a person who specializes in or works at something', or 'a shop or business dealing with something'. For example, 本屋 means 'bookstore', and 魚屋 means 'fishmonger'.",彼はパン屋で働いています。
恐れ,オソレ,osore,動詞-一般,1,fear,The action or feeling of being afraid or anxious about a possible or probable situation or event.,彼は失敗することを恐れている。
山崩れ,ヤマクズレ,yamakuzure,名詞-普通名詞-サ変可能,1,landslide,"A geological phenomenon where a large mass of earth, rocks, and debris falls down a slope, typically triggered by factors like heavy rain, earthquakes, or volcanic activity.",豪雨で山崩れが発生した。
岩,イワ,iwa,名詞-普通名詞-一般,1,rock,"A solid mineral material forming part of the surface of the earth and other similar planets, exposed on the surface or underlying the soil.",大きな岩が川の中にある。
意地,イジ,iji,名詞-普通名詞-一般,1,stubbornness,"A strong or firm resolution in one's own ideas, often associated with an unwillingness to listen to others or change one's mind. It can imply a sense of determination driven by one's own interest or pride.",彼は意地を張って、謝らなかった。
意味,イミ,imi,名詞-普通名詞-サ変可能,1,meaning,"A concept, definition, or explanation intended to convey a significance or the inherent value of something; often used in contexts where interpretation or understanding is required.",この単語の意味を教えてください。
帰さ,カエサ,kaesa,動詞-一般,1,return,To return someone or something to its original place. It can be used when talking about sending someone home or putting something back.,彼を家に帰さなければなりません。
悪かっ,ワルカッ,waruka,形容詞-一般,1,bad,"This word is the past tense form of the adjective '悪い (warui),' which means 'bad,' 'evil,' or 'poor.' It is used to describe something that was bad or unfavorable in a previous situation or event.",昨日の天気は悪かった。
悪,アク,aku,名詞-普通名詞-一般,1,evil,"The word '悪' translates to 'evil' or 'wrong'. It can refer to something immoral, harmful, or undesirable. It is often used in a context that discusses morals or ethics.",その行動は悪だと思います。
恐れ多く,オソレオーク,osoreooku,形容詞-一般,1,intimidating,"This adjective is used to describe something that induces a feeling of awe or reverence, often due to its impressive, sacred, or overwhelming nature. It conveys a sense of being humbled by something significant or grand.",彼の恐れ多くも王の前にひざまずいた。
敵,テキ,teki,名詞-普通名詞-一般,1,enemy,"A person or group that is opposed or hostile to someone or something, often implying a competitor or adversary in some context.",彼は敵と戦っている。
津波,ツナミ,tsunami,名詞-普通名詞-一般,1,tsunami,"A tsunami is a series of powerful ocean waves caused by large-scale disturbances such as earthquakes, volcanic eruptions, or underwater landslides. These waves can travel at high speeds and cause significant destruction when they reach coastal areas.",地震の後、津波警報が発令された。
早く,ハヤク,hayaku,形容詞-一般,1,fast,The term '早く' primarily means 'fast' or 'quickly' and can be used to describe an action done swiftly or ahead of time. It suggests a speediness or promptness in completing a task or response.,彼は早く走ります。
昔,ムカシ,mukashi,名詞-普通名詞-副詞可能,1,past,"In English, this word '昔' typically refers to the past, often denoting a time long ago or in olden days. It can also convey nostalgia or a sense of ancient times.",昔、ここには城がありました。
開け,アケ,hirake,動詞-一般,1,open,"The word '開け' is a verb that means to open, such as opening a door, window, or any other kind of container or space. It implies an action of making something accessible or allowing entry.",ドアを開けてください。
違う,チガウ,chigau,動詞-一般,1,differ,To differ or to be different. It is used to indicate when something is not the same or does not match an expectation.,それは私が聞いた話とは違う。
過ぎ,スギ,sugi,動詞-非自立可能,1,exceed,"The verb '過ぎ' (sugi) in its non-autonomous form is typically used to indicate 'to pass' or 'to exceed', often used with time or degrees, like 'past a certain time' or 'exceeding a limit'. It frequently appears in expressions like 'too much' or 'going beyond' when following adjectives or verbs.",電車が行き過ぎました。
連れ戻す,ツレモドス,tsure,動詞-一般,1,bring back,To return something or someone to its original place or condition. Often used in contexts where someone is being retrieved and brought back to a location they previously left.,彼は迷子になった猫を連れ戻した。
返し,カエシ,kaeshi,動詞-一般,1,return,"The word '返し' refers to the act of returning something to its original state or place. It can mean to give back, repay, or reflect back.",彼は本を図書館に返しに行った。
近づける,チカズケル,chikazu,動詞-一般,1,approach,To bring something closer or to make something approach. It can refer to physically moving an object closer or to figuratively approaching an idea or concept.,私は彼に近づけるために歩きました。
身,ミ,mi,名詞-普通名詞-一般,1,body,The word '身' (mi) in Japanese can mean 'body' or 'oneself.' It often refers to the physical body or is used metaphorically to indicate one's whole being or identity. It can also mean 'flesh' or 'meat' in some contexts.,彼は自分の身を守るために逃げた。
足止め,アシドメ,ashidome,名詞-普通名詞-サ変可能,1,blockade,"A situation in which movement is restricted or stopped, often used to describe preventing someone from leaving or going somewhere, such as due to bad weather or a roadblock.",彼は大雨のため、空港で足止めを食らった。
足手,アシデ,ashide,名詞-普通名詞-一般,1,hindrance,"A term referring to something or someone that acts as an obstacle or burden, limiting progress or causing difficulty.",新しい計画に足手が加わらないようにしましょう。
超え,コエ,koe,動詞-一般,1,exceed,"To surpass a limit or boundary, or to go beyond a certain point or standard.",彼は予想を超えて成功した。
起き,オキ,oki,動詞-一般,1,wake up,The verb '起き' means 'to wake up' or 'to get up'. It describes the action of becoming alert and rising from sleep. It can also imply getting out of bed.,朝6時に起きます。
課題,カダイ,kadai,名詞-普通名詞-一般,1,task,"An issue, task, or problem that needs to be addressed or solved. It can refer to assignments in educational settings or challenges in both personal and professional contexts.",この課題を来週までに提出してください。
説教,セッキョー,sekkyou,名詞-普通名詞-サ変可能,1,sermon,"A sermon refers to a speech or discourse which is often religious in nature, delivered by a preacher to offer guidance. It can also imply giving someone a lecture or reprimanding them, often with a moralizing tone.",彼は教会で日曜日に説教を聞いた。
話,ハナシ,hanashi,名詞-普通名詞-サ変可能,1,talk,"It means 'talk' or 'conversation' and can be used in various contexts such as a formal discussion, an informal chat, or a story being told.",彼との話が楽しかった。
証し,アカシ,shoushi,名詞-普通名詞-一般,1,proof,"""証し"" means evidence or proof, something that serves as a demonstration of truth or verification.",彼の成功は努力の証しです。
訳,ワケ,wake,名詞-普通名詞-一般,1,translation,Translation refers to the process of converting text or speech from one language into another. It can also mean interpretation or meaning in a particular context.,この文章の訳は少し難しい。
許さ,ユルサ,yurusa,動詞-一般,1,allow,To permit or give permission for something to happen or to be done; to forgive or condone.,彼の失礼な発言を許さない。
記し,シルシ,shirushi,動詞-一般,1,write,To write or record something down for the purpose of documentation or memorization.,彼は日記にその出来事を記した。
言い広め,イーヒロメ,ii,動詞-一般,1,spread,"To spread information, news, or rumors widely; to propagate by word of mouth.",彼はその知らせを町中に言い広めた。
解放,カイホー,kaihou,名詞-普通名詞-サ変可能,1,release,"The act of liberating, freeing, or letting go of something or someone. It can refer to the removal of restrictions or obstacles, granting freedom or rights.",彼は長い囚われの生活から解放された。
覚え,オボエ,oboe,動詞-一般,1,remember,"To memorize or learn something so it can be recalled in the future. It can also mean to feel or perceive, to think or recall an experience.",学生はテストのためにたくさんの単語を覚えなければならない。
見つけ,ミツケ,mitsu,動詞-一般,1,find,"The word '見つけ' is the stem or continuative form of the verb '見つける' which means 'to find,' 'to discover,' or 'to locate.' It can refer to the act of coming across something unexpectedly or locating something that was being searched for.",彼は財布を見つけた。
見せれ,ミセレ,mise,動詞-非自立可能,1,show,To let someone see something; to exhibit or display an object or information to another person.,彼は新しい作品を見せれた。
見せ,ミセ,mise,動詞-非自立可能,1,show,"'Mise' is a verb meaning to show or to display something to someone. It often implies presenting or illustrating information, an object, or a demonstration.",彼は新しい車を見せびらかした。
間違い,マチガイ,machigai,名詞-普通名詞-一般,1,mistake,"An error or fault made during a process or action, indicating a misunderstanding or incorrect action.",彼の間違いで会議は延期された。
隣,トナリ,tonari,名詞-普通名詞-一般,1,neighbor,"Can refer to someone or something that is adjacent or next to another person or thing, often used to describe a spatial relationship.",彼の隣に座った。
集まっ,アツマッ,atsuma,動詞-一般,1,gather,To come together or assemble in one place for a common purpose.,人々が公園に集まっている。
ﾋﾅﾀ,ﾋﾅﾀ,hinata,名詞-普通名詞-一般,1,sunny place,"A place that is exposed to the sun, usually referring to a sunny or sunlit area.",家の近くに小さなヒナタがあります。
ﾉｯｸ,ﾉｯｸ,nokku,名詞-普通名詞-一般,1,knock,A sound made by a hand or object hitting a surface like a door. It implies the act of striking a surface to gain attention.,彼はドアをﾉｯｸしてから部屋に入った。
ﾅﾙﾄ,ﾅﾙﾄ,naruto,名詞-普通名詞-一般,1,Naruto,"Naruto is a popular Japanese manga and anime series created by Masashi Kishimoto, featuring the titular character, Naruto Uzumaki, a young ninja with dreams of becoming the Hokage.",テレビでナルトを見た。
ｼｶﾏﾙ,ｼｶﾏﾙ,shikamaru,名詞-普通名詞-一般,1,Shikamaru,"Shikamaru is a personal name commonly used in Japanese culture, notably as a character's name in the anime and manga series 'Naruto'.",昨日、友達のシカマルと遊んだ。
ｻｽｹ,ｻｽｹ,sasuke,名詞-普通名詞-一般,1,Sasuke,"Sasuke is commonly used as a masculine given name in Japan. It is most famously associated with the character Sasuke Uchiha from the manga and anime series 'Naruto.' The name can also refer to historical figures such as Sarutobi Sasuke, a popular character from Japanese folklore.",彼の名前はサスケです。
ｵｰﾌﾟﾆﾝｸﾞﾃｰﾏ,ｵｰﾌﾟﾆﾝｸﾞﾃｰﾏ,o゜fu,名詞-普通名詞-一般,1,opening theme,"An introductory piece of music or melody, typically played at the beginning of a show or event. It sets the tone or theme for what follows.",アニメのオープニングテーマが新しくなりました。
ｴﾝﾃﾞｨﾝｸﾞﾃｰﾏ,ｴﾝﾃﾞｨﾝｸﾞﾃｰﾏ,endingute゜ma,名詞-普通名詞-一般,1,ending theme,"An 'ending theme' refers to the music or song played at the end of a TV show, movie, or video game. It typically accompanies the closing credits or serves as the concluding musical finale for the production.",アニメのｴﾝﾃﾞｨﾝｸﾞﾃｰﾏはとても感動的だった。
ｲﾜﾅ,ｲﾜﾅ,iwana,名詞-普通名詞-一般,1,char,"A type of fish known as 'char' or 'iwana' in Japanese, typically found in cold freshwater rivers and streams. It belongs to the salmon family.",川で大きなイワナを釣った。
集め,アツメ,atsume,動詞-一般,1,Collect,"To gather or bring together things or people, often for a particular purpose. This action involves accumulating items or individuals, usually organized or focused towards achieving something.",彼は切手を熱心に集めています。
１人,ヒトリ,1,名詞-普通名詞-副詞可能,1,one person,"Refers to a single individual or person; can also imply doing something alone, as an adverb.",彼は１人で旅行に出かけました。
高等,コートー,koutou,形状詞-一般,1,high-grade,"Refers to something of higher rank, quality, or level. It can be used in contexts like education (as in secondary school) or describing an elevated quality or standard.",彼は高等教育を受けた。
願い,ネガイ,negai,動詞-非自立可能,1,wish,"The word '願い' serves as an auxiliary verb used to express a wish, desire, or hope for something to happen or be done. It can imply a heartfelt request or an earnest desire.",彼は彼女の幸せを願っている。
顔,カオ,kao,名詞-普通名詞-一般,1,face,"The word '顔' translates to 'face' in English, referring to the front part of a person's or animal's head featuring the eyes, nose, and mouth. It is commonly used to denote expressions, identity, or appearance.",彼の顔はとても優しい。
額当て,ヒタイアテ,hitai,名詞-普通名詞-一般,1,headband,A '額当て' (hidate) refers to a headband often used to protect or decorate the forehead. It can also be a part of certain traditional or ceremonial attire.,彼は額当てをつけて、祭りに参加した。
音,オト,oto,名詞-普通名詞-一般,1,sound,"Refers to a noise, tone, or auditory sensation. Can be used to describe music, ambient noise, or any audible signal.",鳥の音が聞こえます。
見,ミ,ken,動詞-非自立可能,1,see,"The verb '見' (mi) in Japanese commonly means 'to see' or 'to look'. As an auxiliary or non-independent verb form, it can be used in compound verbs to express the action of trying to do something or having a look/trying to see.",この映画を見てみたい。
要する,ヨースル,yousu,動詞-一般,1,require,To require or need something; often used in contexts where something is necessary or takes a certain amount of time or resources.,このプロジェクトは完成に三ヶ月を要する。
褒め,ホメ,home,動詞-一般,1,praise,To express admiration or approval for someone or something. It involves complimenting or giving positive feedback.,彼女は友達の努力を褒めた。
気持ち,キモチ,kimochi,名詞-普通名詞-一般,1,feeling,"An emotional state or reaction; refers to one's inner experience or sentiment, including both physical sensations and emotional experiences.",彼は自分の気持ちを表現するのが苦手です。
狙っ,ネラッ,neratsu,動詞-一般,1,aim,"To aim or target something, usually with intention or purpose. It implies directing one's efforts or actions towards achieving a specific goal.",彼は高い目標を狙っています。
